id,title,selftext,score,num_comments,author,created_utc,url,upvote_ratio,over_18,edited,spoiler,stickied
1ktqbov,"Sharing cache between spark executors, possible?","Hi,

  
I'm trying to make parallel API calls using pyspark RDD.  
I have list of tuples like : (TableName, URL, Offset) . I'm making RDD out of it. So the structure looks like something like this :  


|TableName|URL|Offset|
|:-|:-|:-|
|Invoices|[https://api.example.com/invoices](https://api.example.com/invoices)|0|
|Invoices|[https://api.example.com/invoices](https://api.example.com/invoices)|100|
|Invoices|[https://api.example.com/invoices](https://api.example.com/invoices)|200|
|PurchaseOrders|[https://api.example.com/purchaseOrders](https://api.example.com/purchaseOrders)|0|
|PurchaseOrders|[https://api.example.com/purchaseOrders](https://api.example.com/purchaseOrders)|150|
|PurchaseOrders|[https://api.example.com/purchaseOrders](https://api.example.com/purchaseOrders)|300|

 For each RDD, a function is called to extract data from API and returns a dictionary of data.

Later on I want to filter RDD based on table name and create separate dataframes out of it. Each table has a different schema, so I'm avoiding creating a data frame that could include extra irrelevant schemas for my tables

    rdd = spark.sparkContext.parallelize(offset_tuple_list)
    fetch_rdd = rdd.flatMap(lambda tuple:get_data(tuple,extraction_date,token)).cache()
    
    ## filter RDD per table
    invoices_rdd = fetch_rdd.filter(lambda row: row[""table""] == ""Invoices"")
    purchaseOrders_rdd = fetch_rdd.filter(lambda row: row[""table""] == ""PurchaseOrders"")
    
    ## convert it to json for automatic schema inference by read.json
    invoices_json_rdd = invoices_rdd.map(lambda row: json.dumps(row))
    purchaseOrders_json_rdd = purchaseOrders_rdd.map(lambda row: json.dumps(row))
    
    invoices_df = spark.read.json(invoices_json_rdd)
    purchaseOrders_df = spark.read.json(purchaseOrders_json_rdd)

I'm using cache() to avoid multiple API calls and do it only once.  
My problem is that caching won't work for me if **invoices\_df and purchaseOrders\_df**  are running by different executors. If they are run on the same executor then one takes 3 min and the other a few seconds, since it uses the cache(). If not both take 3 min + 3 min = 6min calling API twice.  
  
This behaviour is random, sometimes it runs on separate executors and I can see locality becomes RACK\_LOCAL instead of PROCESS\_LOCAL  


Any idea how I can make all executors use the same cached RDD? ",3,1,AartaXerxes,2025-05-23 18:06:20,https://www.reddit.com/r/dataengineering/comments/1ktqbov/sharing_cache_between_spark_executors_possible/,0,False,False,False,False
1ktn8tv,Should I switch teams? Manager limiting my growth opportunities,"Background: 

I’m on a support data engineering team and have recently been working on a full stack project that helped me learn new tools and skills that I was really interested in. I really enjoyed the work and felt like I was growing in the right direction. I also expressed my interest in this work with my manager and he said he would forward any similar projects to me as they come. 

The issue: 

However, now my manager seems to have changed his mind and told me that any future full stack opportunities will go to other team members instead of me because “I’ve had enough.” His reasoning is that projects should rotate through the team members one by one before coming back to me. While I understand wanting to give everyone opportunities, this feels like it’s limiting my ability to build expertise and grow in areas where I’m performing well.

I’m also sensing some tension from teammates who seem to think I’m being “greedy” for wanting to continue with this type of work, even though I’m just trying to advance my career like anyone else would.

My question: I’m considering talking to the director of data engineering about potentially switching to a different team that focuses more on core data engineering work rather than support. Is this a reasonable move, or should I try to work things out with my current manager first?

Additional context:
- I’ve been doing well in the full stack/data engineering work and it aligns with my career goals
- This seems to be part of a broader pattern where I feel like growth opportunities are being limited
- The team culture feels like it discourages ambition or self-advocacy

Has anyone been in a similar situation? How did you handle it?

TL;DR: Manager is rotating opportunities away from me after I had success with a project. Considering switching teams. Good idea or should I try to resolve this first?",5,7,eatdrinksleepp,2025-05-23 16:01:41,https://www.reddit.com/r/dataengineering/comments/1ktn8tv/should_i_switch_teams_manager_limiting_my_growth/,0,False,2025-05-23 16:39:30,False,False
1ktv48w,How would you tackle this?,"My company needs to normalize and structure blood test data that comes in PDF format, containing patient data, results, reference values, and status (when outside reference ranges). The PDFs don't have a common template because tests vary from lab to lab, and even within the same lab there are tests written with and without accents or different units of measurement... What strategy would you use for this challenge?",2,0,volvodude-,2025-05-23 21:29:06,https://www.reddit.com/r/dataengineering/comments/1ktv48w/how_would_you_tackle_this/,1,False,False,False,False
1kttnvm,How valuable do you guys find structured learning vs learning/improving on the job?,"I am a mechanical engineer slowly converted into an analytics/data engineer. I'm only around 1.5 years into data engineering and 3 years into working closely with data.

My team primarily works almost exclusively in Databricks, ADF, and Power BI. I've taken a variety of Databricks courses and I recently finished reading Fundamental of Data Engineering but I feel like neither of those have been quite as valuable as I would have hoped. Yes I get small nuggets of info that I didn't know here and there but it feels like a large majority of the info Is not really relevant or is very surface level. Yet it takes a lot of time to go through.   
  
I feel like I have gotten significantly more value out of simply learning on the job. Doing projects and researching questions as they come up. I'm sure there are very nuanced, highly technical questions that come up when working with specific scenarios like IoT or banking information but I don't really experience that.

I've also worked on some wed development side projects in the past that require a DB on that backend and that real life experience has also taught me a lot about both programming principles and optimizing DBs/Queries.

I have three other books that I would consider reading:

* Pragmatic Programmer
* Designing Data Intensive Applications
* Kimball's Data Warehouse Guide

  
I know at least the bottom two are way more technical but is it worth fully reading through from someone who learns better so hands on? Should I just skim through them and look up some basics that I can further deep dive once I know I need it? Or is there really value in reading through it and taking notes? How do you guys approach learning at different points in your career?",2,4,Reddit_Account_C-137,2025-05-23 20:26:24,https://www.reddit.com/r/dataengineering/comments/1kttnvm/how_valuable_do_you_guys_find_structured_learning/,0,False,False,False,False
1ktpa5a,Public data analysis using PostgresSQL and Power BI,"Hey guys!

I just wrapped up a data analysis project looking at publicly available development permit data from the city of Fort Worth.

I did a manual export, cleaned in Postgres, then visualized the data in a Power Bi dashboard and described my findings and observations.

This project had a bit of scope creep and took about a year. I was between jobs and so I was able to devote a ton of time to it.

The data analysis here is part 3 of a series. The other two are more focused on history and context which I also found super interesting.

I would love to hear your thoughts if you read it. 

Thanks ! 

https://medium.com/sergio-ramos-data-portfolio/city-of-fort-worth-development-permits-data-analysis-99edb98de4a6  ",2,1,0sergio-hash,2025-05-23 17:24:13,https://www.reddit.com/r/dataengineering/comments/1ktpa5a/public_data_analysis_using_postgressql_and_power/,0,False,False,False,False
1ktjkf6,Should I do the AWS SAA Certification or skip and go straight to AWS DE Certification?,Bit of a background: I am currently working in Amazon as a business intelligence engineer. I plan on eventually switching to DE in 2-3 years time but first would like to gain some experience in my current role first. The main reason for doing these certifications is not only to help bolster my internal move to a DE role in amazon but outside as well when I move out of Amazon in the future. I have minimal interaction with AWS data tools except for quicksights (visualization tool). AWS DE certification is the ultimate prize but should I do the AWS SAA first? I'm still relatively new in the BIE role and have lots to learn about DE practices and core technical skills around that role. I also already have an AWS CCP certification but we all know how basic that is compared to SAA.,2,0,rudimentaryblues,2025-05-23 13:27:48,https://www.reddit.com/r/dataengineering/comments/1ktjkf6/should_i_do_the_aws_saa_certification_or_skip_and/,0,False,2025-05-23 14:18:29,False,False
1ktxzdt,Struggling in the Current Market – Seeking Advice and Support from Fellow Data Engineers,"Hey folks,

Just wanted to share a bit and maybe get some advice or help if anyone’s around.

I’ve been working as a data engineer for about 5 years now — real hands-on experience building pipelines, working with cloud tools, databases, all that stuff. My last job was a contract role and it ended a little over a month ago. Since then, I’ve been applying non-stop — probably hundreds of applications by now.

I’m not just spraying my CV either. I actually read each job description and tweak my CV to match what they’re asking for. I know the market is tough right now, but it’s been a bit frustrating not hearing back much, even with solid experience.

Just wondering if anyone here has any tips that helped them during their job search, or maybe knows someone hiring or could point me in the right direction. I’m open to full-time, contract, freelance — anything to get back to work.

Appreciate any help or advice. Thanks for reading.
",1,4,Careful-King-276,2025-05-23 23:43:01,https://www.reddit.com/r/dataengineering/comments/1ktxzdt/struggling_in_the_current_market_seeking_advice/,1,False,False,False,False
1ktxryz,Starting from scratch with automation,"Hello, 

I am not really a dataengineer but after looking at what I'm going to be working on I may be one soon. 

  
Ok to start with the project, I work for a clinical research company and we currently are pulling reports manually and working with them in excel (occasionally making visualizaitons).  We pull from two sources, one we own but can't access (we could probably ask but we want a proof of concept first) but the other source we can use their API to access our data on their system.  

I am looking for open-source (free) programs I can use to take the information given in the API break it into a full database (dataset tables) and keep in constantly updated in a gateway.  In this phase of the project I am more invested in being able to do an API call and automatically pulling the data to set it into the appropriate schema. 

I have a really good understanding of dataset creation put I am new to the scripting an API side.  

I don't really know what else to add but if you have any follow up questions please comment. 

  
I appreciate any help or advice you can give me. (I will be using our lord and savior youtube to learn as much as I can about whatever you suggest). ",1,2,bmiller201,2025-05-23 23:32:35,https://www.reddit.com/r/dataengineering/comments/1ktxryz/starting_from_scratch_with_automation/,1,False,False,False,False
1ktu9ru,"Amazon L4 or Stable, Comfortable Job as New Grad?","Hello fellow data engineers,

Hoping for some guidance on how to evaluate an offer I just got from Amazon.

Currently working hybrid (1-2 days), \~120k in VHCOL city, offer is for \~160 in HCOL city.

My current job has been alright, but I am a team of one, and there is very little ""data engineering"" to do around here. Feel a little bit stagnant in that regard. Often just uploading Excel files and running some stored procedure/ETL. I'm looking at around 35 hours a week, pretty lax.

Not sure what to expect at Amazon, 50 hours a week, 60? I know the experience would probably be huge for my career, but not sure if I'm willing to pay with my life. I am also aware that I would go from hardly going into the office to going in every day.

Any current or prior Amazon DE's that could weigh in here? Am I walking into a death trap?",1,9,Interesting_Tea6963,2025-05-23 20:52:57,https://www.reddit.com/r/dataengineering/comments/1ktu9ru/amazon_l4_or_stable_comfortable_job_as_new_grad/,0,False,False,False,False
1ktcc05,LLM / AI use case for logs,"I’m exploring LLMs to make sense of large volumes of logs—especially from data tools like DataStage, Airflow, or Spark—and I’m curious:
	•	Has anyone used an LLM to analyze logs, classify errors, or summarize root causes?
	•	Are there any working log analysis use cases (not theoretical) that actually made life easier?
	•	Any open-source projects or commercial tools that impressed you?
	•	What didn’t work when you tried using AI/LLMs on logs?

Looking for real examples, good or bad. I’m building something similar and want to avoid wasting cycles on what’s already been tried.",1,2,Different-Future-447,2025-05-23 06:02:01,https://www.reddit.com/r/dataengineering/comments/1ktcc05/llm_ai_use_case_for_logs/,0,False,False,False,False
1kte7ur,Modular pipeline design: ADF + Databricks notebooks,"I'm building ETL pipelines using ADF for orchestration and Databricks notebooks for logic. Each notebook handles one task (e.g., dimension load, filtering, joins, aggregations), and pipelines are parameterized.

The issue: joins and aggregations need to be separated, but Databricks doesn’t allow sharing persisted data across notebooks easily. That forces me to write intermediate tables to storage.

**Is this the right approach?**

* Should I combine multiple steps (e.g., join + aggregate) into one notebook to reduce I/O?
* Or is there a better way to keep it modular without hurting performance?

Any feedback on best practices would be appreciated.",0,4,ur64n-,2025-05-23 08:12:35,https://www.reddit.com/r/dataengineering/comments/1kte7ur/modular_pipeline_design_adf_databricks_notebooks/,0,False,False,False,False
1ktb2jo,Anyone else dealing with messy fleet data?,"Between GPS logs, fuel cards, and maintenance reports, our fleet data used to live everywhere — and nowhere at the same time.

We recently explored how cloud-based data warehousing can clean that up. Better asset visibility, fewer surprises, and way easier decision-making.

Here’s a blog that breaks it down if you're curious:  
🔗 [Fleet Management & Cloud-Based Warehousing](https://data-sleek.com/blog/fleet-management-cloud-based-data-warehousing/)

Curious how others are solving this — are you centralizing your data or still working across multiple systems?",0,0,Data-Sleek,2025-05-23 04:41:29,https://www.reddit.com/r/dataengineering/comments/1ktb2jo/anyone_else_dealing_with_messy_fleet_data/,0,False,False,False,False
1kt7ve2,I've built a Cursor for data with context aware agent and auto-complete (Now working for BigQuery),,0,0,jekapats,2025-05-23 01:46:01,https://cipher42.ai,0,False,False,False,False
