id,title,selftext,score,num_comments,author,created_utc,url,upvote_ratio,over_18,edited,spoiler,stickied
1kuvrue,How to create a Dropbox like personal and enterprise storage system?,"All of us have been using Dropbox or Google Drive for storing our stuff online, right? They allow us to share files with others via URLs or email address based permissions, and in case of Google Drive, the entire workspace can be dedicated to an organization.

How to create one such system from scratch? The simplest way I can think of - is implement a raw object storage first (like S3 or Backblaze) that takes care of file replication (either directly or via Reed Solon Erasure Codes) - and once done, use that everywhere along with file metadata (like folder structure, permissions, etc.) stored in a DB to give the user an illusion of their own personal har disk for storing files.

Is this a good way? Is that how, for example, Google Drive works? What other ways are there to make a distributed file storage system like Dropbox or Google Drive?",0,1,Attitudemonger,2025-05-25 06:16:40,https://www.reddit.com/r/dataengineering/comments/1kuvrue/how_to_create_a_dropbox_like_personal_and/,0,False,False,False,False
1kuyxmq,DORA metrics in data engineering,"What do you, fellow DEs think of applying DORA metrics to our work? does it make sense, and if so, whould it need rewording or adjustments?",2,5,Dry-Aioli-6138,2025-05-25 09:56:56,https://www.reddit.com/r/dataengineering/comments/1kuyxmq/dora_metrics_in_data_engineering/,0,False,False,False,False
1kvdcvw,Have $200 tix to World Summit AI USA.,"Anyone that's interested in going to World Summit AI USA, please DM me or message me on Instagram @sznxar. I have tickets for $200. The ticket value is $700. 

",0,0,Ferrocius,2025-05-25 21:18:18,https://www.reddit.com/r/dataengineering/comments/1kvdcvw/have_200_tix_to_world_summit_ai_usa/,0,False,False,False,False
