id,title,selftext,score,num_comments,author,created_utc,url,upvote_ratio,over_18,edited,spoiler,stickied
1k6r1by,Looking for insights from current Solution Architects or Senior Solution Architects at Databricks (or similar tech organizations) — what are the key differences in roles and responsibilities between the two positions?,"

Here is some background, I'm currently in the interviewing process for a presales solution architect at Databricks in Canada. I am currently employed as a senior manager at a consulting firm where I largely work on technical project delivery. I understand the role at Databrick is more client conversation and less technical, but what I'm trying to evaluate is how did others shift from people management to a presales roles and also whether I should target for a senior or specialist solution architect role rather than a solution architect.

I am fairly technical and solution most of the work and deep dive into day-to-day technical issues.",1,1,Opening_Ad6142,2025-04-24 12:32:38,https://www.reddit.com/r/dataengineering/comments/1k6r1by/looking_for_insights_from_current_solution/,0,False,False,False,False
1k6p7x9,How do you handle real-time data access (<100ms) while keeping bulk ingestion efficient and stable?,"We’re currently indexing blockchain data using our Golang services, sending it into Redpanda, and from there into ClickHouse via the Kafka engine. This data is then exposed to consumers through our GraphQL API.

However, we’ve run into issues with real-time ingestion. Pushing data into ClickHouse at high frequency is causing too many merge parts and system instability — to the point where insert blocks are occasionally being rejected. This is especially problematic since some of our data (like blocks and transactions) needs to be available in real-time, with query latency under 100ms.

To manage this better, we’re considering separating our ingestion strategy: keeping batch ingestion into ClickHouse for historical and analytical needs, while finding a way to access fresh data in real-time when needed — particularly for the GraphQL layer.

Would love to get thoughts on how we can approach this — especially around managing real-time queryability while keeping ingestion efficient and stable.",1,7,not_happy_kratos,2025-04-24 10:52:14,https://www.reddit.com/r/dataengineering/comments/1k6p7x9/how_do_you_handle_realtime_data_access_100ms/,0,False,False,False,False
1k6mqe7,File Monitoring on AWS,"Here for some advice...

  
I'm hoping to build a PowerBI dashboard to display whether our team has received a file in our S3 bucket each morning. We have circa 200+ files received every morning, and we need to be aware if one of our providers hasn't delivered.

  
My hope is to set up event notifications from S3, that can be used to drive the dashboard. We know the filenames we're expecting, and the time each should arrive, but have got a little lost on the path between S3 & PowerBI.

  
We are an AWS house (mostly), so was considering using SQS, SNS, Lambda... But, still figuring out the flow. Any suggestions would be greatly appreciated! TIA",1,0,Feedthep0ny,2025-04-24 07:56:42,https://www.reddit.com/r/dataengineering/comments/1k6mqe7/file_monitoring_on_aws/,0,False,False,False,False
1k72yym,Why does Trino baseline specs are so extreme? isn't it overkill?,"Hi, i'm currently swapping my company data warehouse to a more modular solution using, among other things, a data lake.

I'm using Trino to set up a cluster and using it to connect to my AWS glue catalog and access my data on S3 buckets.

So, while setting Trino up, i was looking at their docs and some forum answers, and why does everywhere i look, people suggest ludicrous powerful machines as a baseline for trino? People recomend 64GB m5.4xlarge as a baseline for EACH worker? saying stuff like ""200GB should be enough for a starting point"".

I get it, Trino might be a really good solution for big datasets, and some bigger companies might just not care about expending 5k USD monthly only on EC2. But a smaller company with 4 employees, a startup, specially one located on other regions beyond us-east, simply saying you need 5x 4xlarge instances is, well, a lot...  
(for comparison, in my country, 5kUSD pays the salary of all members of the team and cover most of our other costs. and we have above average salaries for staff engineers...)  
  
I initially set my Trino cluster up with a 8gb ram machine and workers with 4 gb (t3.large and t3.medium on aws Ec2) and trino is actually working well, I have a 2TB dataset, which for many, is actually enough space.

Am I missing something? Is Trino bad as a simple solution for something like simply replacing athena queries costs and having more control over my data? Should i be looking somewhere else? Or is this just simply a problem of ""usually companies have a bigger budget?""

How can i get what is really a minimum baseline for using it?

",0,9,Glass_Celebration217,2025-04-24 20:46:51,https://www.reddit.com/r/dataengineering/comments/1k72yym/why_does_trino_baseline_specs_are_so_extreme_isnt/,0,False,False,False,False
1k6ugw8,Just realized that I don't fully understand how Snowflake decouples storage and compute. What happens behind the scenes from when I submit a query to when I see the results?,"I've worked with Snowflake for a while and understood that storage was separated from compute. In my head that makes sense but practically speaking realized I didn't know how a query is processed and data is loaded from storage onto a DW. Is there anything special going on? 

For example, let's say I have a table employees without any partitioning and run a basic query of `select department, count(*) from employees where start_date > '2020-01-01'` and using a Large data warehouse. Can someone explain what happens after I hit run on the query until I see the results?",0,6,jbnpoc,2025-04-24 15:03:28,https://www.reddit.com/r/dataengineering/comments/1k6ugw8/just_realized_that_i_dont_fully_understand_how/,0,False,False,False,False
1k6l84c,[Help Needed] Trying to build a real-time MongoDB + Neo4j project — does this make sense?,"Hi everyone 👋

I’m trying to work on a new project to improve my data engineering skills and would love to get some advice from people more experienced in real-world systems.

# 🔁 What I’m Trying to Do:

I previously built a Medallion Architecture project using MongoDB, Pandas, and PostgreSQL (Bronze → Silver → Gold). It helped me understand the basics of ELT pipelines.

Now I want to do something different, so I’m trying to build a **real-time pipeline** that also uses **graph modeling**. Here’s my rough idea:

* Use **MongoDB Atlas** to store real-time event data (e.g., product views, purchases)
* Use **AWS Lambda** to process/clean those events.
* Push the cleaned events into **Neo4j** to create user-product relationships (for example: `(:User)-[:VIEWED]->(:Product)`)

I’d also like to simulate the stream using Python + Faker, just to have some data coming in regularly.

# 🙋‍♂️ Where I’m Stuck / Need Help:

1. **Is it even a good idea to combine MongoDB and Neo4j like this?** Or should I focus on just one?
2. Are there any common mistakes or traps I should watch out for with this kind of setup?
3. Any suggestions on making it more realistic or structured like a production system?

I’m still learning and trying to figure out how to make this useful, so any feedback or tips would mean a lot.

Thanks in advance 🙏",0,1,Loud-Effective7198,2025-04-24 06:11:39,https://www.reddit.com/r/dataengineering/comments/1k6l84c/help_needed_trying_to_build_a_realtime_mongodb/,0,False,2025-04-24 07:00:27,False,False
1k776e5,How Should I Approach My Job Search As An Eager Learner with Limited Experience?,"I come from a non-technical degree and self-taught background and I work for a US non-profit where I wear many hats; data engineer, Microsoft Power Platform developer, Data Analyst, and User Support. I want to move to a more specialized DE role. We currently have an on-premise SQL Server stack with a pipeline managed by SSIS packages that feed into an SSAS cube as our warehouse for reporting in Power BI reports that I also develop.

Our senior DE retired last year and I have been solely managing and trying to modernize the pipeline and warehouse since as much as I can with an on-premise setup. I pushed for a promotion and raise in the wake of that but the organization is stubborn and it was denied. I have completed the Data Talks Studio DE Zoomcamp certificate in an effort to show that I am eager to move into more cloud based data engineering despite my limited professional experience.

I need to leave this job as they are unwilling to match my responsibilities with an appropriate salary. My question to the sub is what approach should I take to my job search? Where should I be looking for jobs? What kinds of jobs should I be looking for? Should I look for bridge roles like Data Analyst or Analytics Engineer? If anyone would be willing to mentor me through this a bit, that would also be greatly appreciated.",0,0,cjones91594,2025-04-24 23:57:00,https://www.reddit.com/r/dataengineering/comments/1k776e5/how_should_i_approach_my_job_search_as_an_eager/,0,False,False,False,False
1k715xq,Data Engineering Manager Tech Screen Prep,Hi! I have a final round technical screen next week for a Data Engineering Manager role. I have a strong data analytics/data science leadership background and have dipped my toes into DE from time to time over more than a decade long career. I'm looking for good prep tools for this (hands on) Manager level role.,0,1,redrumredrun,2025-04-24 19:32:50,https://www.reddit.com/r/dataengineering/comments/1k715xq/data_engineering_manager_tech_screen_prep/,0,False,False,False,False
1k6nokk,EY GDS vs Deloitte India for Azure Data Engineer,"Hi folks,  
I got two offers in hand, one is from EY GDS for 10.5LPA + 5% VBA (which I heard people actually get around 10-20% on a A or B rating) and Deloitte India 11 LPA + 10% VPB (Didn't accepted the offer yet, asked for 14 LPA ). Which one should I join, which is better in terms of projects, work culture and career growth. I have 5 days to decide.",0,4,Creepy_Area5974,2025-04-24 09:06:20,https://www.reddit.com/r/dataengineering/comments/1k6nokk/ey_gds_vs_deloitte_india_for_azure_data_engineer/,0,False,False,False,False
1k6idhk,Which degree has the best ROI,"Hi all. I’m considering another degree to put off paying back student loans. In the US if you’re in school at least part time (6 hours every long semester) your loans will be in deferment and not impacting your credit. I’m curious what degree (preferably online) has the best ROI. I’m a Senior Azure Data Engineer and I already have a Bachelor’s and Master’s degree in Management Information Systems. I was thinking of maybe getting an associates in Computer Science from a community college then getting a Masters in Computer Science. I’m open to suggestions. Unfortunately I don’t think there’s an official master or bachelor’s of data engineering, otherwise I’d do that. I’m not interested in management yet so an MBA is a highly unlikely. Cybersecurity is cool but I like my career in data. Maybe if there’s no other options. Thanks in advance. 

PS. This isn’t a political post. I don’t care whether people pay student loans or not, I just don’t want to pay mine yet. ",0,21,hijkblck93,2025-04-24 03:20:18,https://www.reddit.com/r/dataengineering/comments/1k6idhk/which_degree_has_the_best_roi/,0,False,2025-04-24 03:27:49,False,False
